{
  "schema_version": "1.0.0",
  "decision_id": "20260217T050658Z:job-002-verify-content",
  "timestamp_utc": "2026-02-17T05:07:02Z",
  "kernel_version": "scbe-kernel-v1",
  "profile_id": "default-safe",
  "job_id": "job-002-verify-content",
  "agent_id": "agent-2-verify",
  "session_id": "verify-session-1",
  "workflow_id": "wf-market-scan",
  "runner_run_id": "20260217T050658Z",
  "request_run_id": "run-002",
  "decision": "NOISE",
  "decision_reason": "verification score < 0.60",
  "risk_tier": "REFLEX",
  "metrics": {
    "risk": 0.246128,
    "d_star": 0.462117,
    "coherence": 0.7539,
    "verification_score": 0.5
  },
  "capability": {
    "required": false,
    "present": false,
    "valid": true,
    "token_id": null,
    "reason": "ok"
  },
  "trace_hash": "4ede3053c2e37f0b9c8d39f16264feecd8a3e796dcb9678a3d16a353c0bcc2ea",
  "verification": {
    "score": 0.5,
    "passed_checks": 3,
    "total_checks": 6,
    "checks": [
      {
        "check": "action_success_1",
        "passed": true
      },
      {
        "check": "action_success_2",
        "passed": false
      },
      {
        "check": "action_success_3",
        "passed": true
      },
      {
        "check": "must_contain::Herman Melville",
        "passed": false
      },
      {
        "check": "selector::h1",
        "passed": false
      },
      {
        "check": "max_redirects",
        "passed": true,
        "observed": 1,
        "expected_max": 3
      }
    ]
  }
}